{
  "schemaVersion": "1.0.0",
  "configVersion": "valid-disabled",
  "enabled": false,
  "issuedAt": "2026-07-19T00:00:00.000Z",
  "expiresAt": "2099-01-01T00:00:00.000Z",
  "killSwitch": {
    "engaged": true,
    "reason": "demo-disabled"
  },
  "privacyProfile": "strict",
  "sampling": {
    "sessionSampleRate": 0
  },
  "rum": {},
  "browserLogs": {
    "enabled": false
  },
  "sessionReplay": {
    "enabled": false
  },
  "sensitiveRoutes": []
}
