{
  "schemaVersion": "1.0.0",
  "configVersion": "future-dated",
  "enabled": true,
  "issuedAt": "2099-01-01T00:00:00.000Z",
  "expiresAt": "2099-01-02T00:00:00.000Z",
  "killSwitch": {
    "engaged": false
  },
  "privacyProfile": "strict",
  "sampling": {
    "sessionSampleRate": 0.5
  },
  "rum": {
    "site": "observability.example.invalid",
    "organizationIdentifier": "demo-org",
    "applicationId": "demo-app",
    "clientToken": "fixture client token test value",
    "apiVersion": "v1"
  },
  "browserLogs": {
    "enabled": false
  },
  "sessionReplay": {
    "enabled": false
  },
  "sensitiveRoutes": []
}
